{
  "id": "attom-data",
  "overall": "fail",
  "verdicts": {
    "base_url": {
      "verdict": "confirm",
      "correction": null,
      "source": "https://api.developer.attomdata.com/docs"
    },
    "docs_url": {
      "verdict": "confirm",
      "correction": null,
      "source": "https://api.developer.attomdata.com/docs"
    },
    "auth_type": {
      "verdict": "confirm",
      "correction": null,
      "source": "https://api.developer.attomdata.com/docs"
    },
    "free_tier": {
      "verdict": "confirm",
      "correction": null,
      "source": "https://api.developer.attomdata.com/"
    },
    "free_tier_limits": {
      "verdict": "confirm",
      "correction": null,
      "source": "https://api.developer.attomdata.com/"
    },
    "rate_limits": {
      "verdict": "confirm",
      "correction": null,
      "source": "https://api.developer.attomdata.com/docs"
    },
    "cors": {
      "verdict": "confirm",
      "correction": null,
      "source": null
    },
    "example": {
      "verdict": "confirm",
      "correction": null,
      "source": "https://api.developer.attomdata.com/docs"
    },
    "description": {
      "verdict": "confirm",
      "correction": null,
      "source": "https://www.attomdata.com/"
    }
  },
  "notes": "Adversarial review: base URL, docs, API-key auth, trial free tier, unpublished rate limits, and example path match official ATTOM developer portal (2026). No shutdown or migration notices found. CORS remains unknown (not published)."
}