{
  "id": "tiingo",
  "overall": "pass",
  "verdicts": {
    "base_url": {
      "verdict": "confirm",
      "correction": null,
      "source": null
    },
    "docs_url": {
      "verdict": "confirm",
      "correction": null,
      "source": null
    },
    "auth_type": {
      "verdict": "confirm",
      "correction": null,
      "source": null
    },
    "free_tier": {
      "verdict": "confirm",
      "correction": null,
      "source": null
    },
    "free_tier_limits": {
      "verdict": "confirm",
      "correction": null,
      "source": null
    },
    "rate_limits": {
      "verdict": "confirm",
      "correction": null,
      "source": null
    },
    "cors": {
      "verdict": "confirm",
      "correction": null,
      "source": null
    },
    "example": {
      "verdict": "confirm",
      "correction": null,
      "source": null
    },
    "description": {
      "verdict": "confirm",
      "correction": null,
      "source": null
    }
  },
  "notes": "placeholder"
}