{
  "id": "abstract-email",
  "overall": "fail",
  "verdicts": {
    "base_url": {
      "verdict": "confirm",
      "correction": null,
      "source": "https://docs.abstractapi.com/email-validation"
    },
    "docs_url": {
      "verdict": "incorrect",
      "correction": "https://docs.abstractapi.com/email-validation",
      "source": "https://docs.abstractapi.com/email-validation"
    },
    "auth_type": {
      "verdict": "confirm",
      "correction": null,
      "source": "https://docs.abstractapi.com/email-validation"
    },
    "free_tier": {
      "verdict": "confirm",
      "correction": null,
      "source": "https://www.abstractapi.com/api/email-validation"
    },
    "free_tier_limits": {
      "verdict": "confirm",
      "correction": null,
      "source": "https://www.abstractapi.com/api/email-validation"
    },
    "rate_limits": {
      "verdict": "confirm",
      "correction": null,
      "source": "https://docs.abstractapi.com/email-validation"
    },
    "cors": {
      "verdict": "confirm",
      "correction": null,
      "source": null
    },
    "example": {
      "verdict": "confirm",
      "correction": null,
      "source": "https://docs.abstractapi.com/email-validation"
    },
    "description": {
      "verdict": "confirm",
      "correction": null,
      "source": "https://docs.abstractapi.com/email-validation"
    }
  },
  "notes": "docs_url returned HTTP 404 in automated checks; need to verify against current official sources."
}