{
  "id": "awattar",
  "overall": "pass",
  "verdicts": {
    "base_url": {
      "verdict": "confirm",
      "correction": null,
      "source": "https://www.awattar.de/services/api"
    },
    "docs_url": {
      "verdict": "confirm",
      "correction": null,
      "source": "https://www.awattar.de/services/api"
    },
    "auth_type": {
      "verdict": "confirm",
      "correction": null,
      "source": "https://www.awattar.de/services/api"
    },
    "free_tier": {
      "verdict": "confirm",
      "correction": null,
      "source": "https://www.awattar.de/services/api"
    },
    "free_tier_limits": {
      "verdict": "confirm",
      "correction": null,
      "source": "https://www.awattar.de/services/api"
    },
    "rate_limits": {
      "verdict": "confirm",
      "correction": null,
      "source": "https://www.awattar.de/services/api"
    },
    "cors": {
      "verdict": "confirm",
      "correction": null,
      "source": null
    },
    "example": {
      "verdict": "confirm",
      "correction": null,
      "source": "https://www.awattar.de/services/api"
    },
    "description": {
      "verdict": "confirm",
      "correction": null,
      "source": "https://www.awattar.de/services/api"
    }
  },
  "notes": "Verified against official aWATTar API docs; public marketdata endpoints match entry."
}