{
  "id": "open-brewery-db",
  "overall": "pass",
  "verdicts": {
    "base_url": {
      "verdict": "confirm",
      "correction": null,
      "source": "https://www.openbrewerydb.org/documentation"
    },
    "docs_url": {
      "verdict": "confirm",
      "correction": null,
      "source": "https://www.openbrewerydb.org/documentation"
    },
    "auth_type": {
      "verdict": "confirm",
      "correction": null,
      "source": "https://www.openbrewerydb.org/documentation"
    },
    "free_tier": {
      "verdict": "confirm",
      "correction": null,
      "source": "https://www.openbrewerydb.org/"
    },
    "free_tier_limits": {
      "verdict": "confirm",
      "correction": null,
      "source": "https://www.openbrewerydb.org/"
    },
    "rate_limits": {
      "verdict": "confirm",
      "correction": null,
      "source": "https://www.openbrewerydb.org/documentation"
    },
    "cors": {
      "verdict": "confirm",
      "correction": null,
      "source": "https://www.openbrewerydb.org/documentation"
    },
    "example": {
      "verdict": "confirm",
      "correction": null,
      "source": "https://www.openbrewerydb.org/documentation"
    },
    "description": {
      "verdict": "confirm",
      "correction": null,
      "source": "https://www.openbrewerydb.org/"
    }
  },
  "notes": "All claims checked against official Open Brewery DB site and documentation (2026). API is free, no auth, v1 base URL confirmed, CORS enabled, example curl matches docs; rate limits not published."
}