{
  "id": "idealista",
  "overall": "pass",
  "verdicts": {
    "base_url": {
      "verdict": "unverifiable",
      "correction": null,
      "source": null
    },
    "docs_url": {
      "verdict": "confirm",
      "correction": null,
      "source": "https://developers.idealista.com/access-request?action=main"
    },
    "auth_type": {
      "verdict": "unverifiable",
      "correction": null,
      "source": null
    },
    "free_tier": {
      "verdict": "unverifiable",
      "correction": null,
      "source": null
    },
    "free_tier_limits": {
      "verdict": "unverifiable",
      "correction": null,
      "source": null
    },
    "rate_limits": {
      "verdict": "unverifiable",
      "correction": null,
      "source": null
    },
    "cors": {
      "verdict": "unverifiable",
      "correction": null,
      "source": null
    },
    "example": {
      "verdict": "unverifiable",
      "correction": null,
      "source": null
    },
    "description": {
      "verdict": "confirm",
      "correction": null,
      "source": "https://www.idealista.it/data/consulenza-immobiliare-tecnologica/api-confrontabili-e-metriche/"
    }
  },
  "notes": "The current official developer page confirms a Search API and project-reviewed API-key access, but exposes no public endpoint, authentication-flow, pricing, limits, CORS, or request-reference details. Official idealista/data pages confirm business-oriented property and market-data APIs; the public evidence was insufficient to validate the sample curl."
}