{
  "id": "iqair-airvisual",
  "overall": "pass",
  "verdicts": {
    "base_url": {
      "verdict": "confirm",
      "correction": null,
      "source": "https://api-docs.iqair.com/"
    },
    "docs_url": {
      "verdict": "incorrect",
      "correction": "https://api-docs.iqair.com/",
      "source": "https://www.iqair.com/air-pollution-data-api"
    },
    "auth_type": {
      "verdict": "confirm",
      "correction": null,
      "source": "https://api-docs.iqair.com/"
    },
    "free_tier": {
      "verdict": "confirm",
      "correction": null,
      "source": "https://www.iqair.com/commercial/air-quality-monitors/airvisual-platform/api"
    },
    "free_tier_limits": {
      "verdict": "confirm",
      "correction": null,
      "source": null
    },
    "rate_limits": {
      "verdict": "confirm",
      "correction": null,
      "source": null
    },
    "cors": {
      "verdict": "confirm",
      "correction": null,
      "source": null
    },
    "example": {
      "verdict": "confirm",
      "correction": null,
      "source": "https://api-docs.iqair.com/"
    },
    "description": {
      "verdict": "confirm",
      "correction": null,
      "source": "https://www.iqair.com/air-pollution-data-api"
    }
  },
  "notes": "docs_url points to marketing; official API reference is api-docs.iqair.com. base_url /v2 and key= query auth confirmed. Free Community plan exists; exact free limits and rate limits not clearly published as fixed numbers in open docs."
}