{
  "id": "mbta-v3",
  "overall": "fail",
  "verdicts": {
    "base_url": {
      "verdict": "confirm",
      "correction": null,
      "source": "https://api-v3.mbta.com/"
    },
    "docs_url": {
      "verdict": "confirm",
      "correction": null,
      "source": "https://api-v3.mbta.com/docs/swagger/index.html"
    },
    "auth_type": {
      "verdict": "confirm",
      "correction": null,
      "source": "https://www.mbta.com/developers/v3-api"
    },
    "free_tier": {
      "verdict": "confirm",
      "correction": null,
      "source": "https://www.mbta.com/developers/v3-api"
    },
    "free_tier_limits": {
      "verdict": "confirm",
      "correction": null,
      "source": "https://www.mbta.com/developers/v3-api"
    },
    "rate_limits": {
      "verdict": "confirm",
      "correction": null,
      "source": "https://www.mbta.com/developers/v3-api"
    },
    "cors": {
      "verdict": "confirm",
      "correction": null,
      "source": null
    },
    "example": {
      "verdict": "confirm",
      "correction": null,
      "source": "https://api-v3.mbta.com/docs/swagger/index.html"
    },
    "description": {
      "verdict": "confirm",
      "correction": null,
      "source": "https://www.mbta.com/developers/v3-api"
    }
  },
  "notes": "Placeholder \u2014 will verify against live official sources"
}