{
  "id": "tenor",
  "overall": "pass",
  "verdicts": {
    "base_url": {
      "verdict": "confirm",
      "correction": null,
      "source": "https://developers.google.com/tenor/guides/quickstart"
    },
    "docs_url": {
      "verdict": "confirm",
      "correction": null,
      "source": "https://developers.google.com/tenor"
    },
    "auth_type": {
      "verdict": "confirm",
      "correction": null,
      "source": "https://developers.google.com/tenor/guides/quickstart"
    },
    "free_tier": {
      "verdict": "confirm",
      "correction": null,
      "source": "https://developers.google.com/tenor/guides/quickstart"
    },
    "free_tier_limits": {
      "verdict": "confirm",
      "correction": null,
      "source": null
    },
    "rate_limits": {
      "verdict": "confirm",
      "correction": null,
      "source": "https://developers.google.com/tenor/guides/usage-limits"
    },
    "cors": {
      "verdict": "unverifiable",
      "correction": null,
      "source": null
    },
    "example": {
      "verdict": "confirm",
      "correction": null,
      "source": "https://developers.google.com/tenor/guides/endpoints"
    },
    "description": {
      "verdict": "confirm",
      "correction": null,
      "source": "https://developers.google.com/tenor"
    }
  },
  "notes": "Verified against Google Tenor v2 docs. Base URL, key auth, search example, and ownership claims hold. Free tier exists with unpublished hard limits; rate limits documented as soft/default guidance. CORS not stated in official docs."
}