{
  "id": "humane",
  "overall": "fail",
  "verdicts": {
    "base_url": {
      "verdict": "incorrect",
      "correction": "No operational public Humane API base URL exists; Humane discontinued its connected services on February 28, 2025.",
      "source": "https://support.humane.com/hc/en-us/articles/34243204841997-Ai-Pin-Consumers-FAQ"
    },
    "docs_url": {
      "verdict": "incorrect",
      "correction": "No current public Humane developer-documentation URL was found; https://api.humane.com is unreachable and unsupported by official sources.",
      "source": "https://support.humane.com/hc/en-us/articles/34374173951373-Important-Update-for-Consumer-Ai-Pin-Customers"
    },
    "auth_type": {
      "verdict": "unverifiable",
      "correction": null,
      "source": null
    },
    "free_tier": {
      "verdict": "unverifiable",
      "correction": null,
      "source": null
    },
    "free_tier_limits": {
      "verdict": "unverifiable",
      "correction": null,
      "source": null
    },
    "rate_limits": {
      "verdict": "unverifiable",
      "correction": null,
      "source": null
    },
    "cors": {
      "verdict": "unverifiable",
      "correction": null,
      "source": null
    },
    "example": {
      "verdict": "incorrect",
      "correction": "No valid current request example exists for the alleged API; its root URL is unreachable and Humane's connected services were discontinued.",
      "source": "https://support.humane.com/hc/en-us/articles/34243204841997-Ai-Pin-Consumers-FAQ"
    },
    "description": {
      "verdict": "incorrect",
      "correction": "Humane no longer provides the claimed public search and knowledge-retrieval API. HP acquired Humane's Cosmos platform and personnel for HP IQ, while Humane's connected services were wound down.",
      "source": "https://www.hp.com/us-en/newsroom/press-releases/2025/hp-accelerates-ai-software-investments-to-transform-the-future-of-work.html"
    }
  },
  "notes": "Official Humane notices say server connectivity, AI responses, and cloud access ended February 28, 2025. HP acquired Humane's Cosmos technology and formed HP IQ. Current official HP materials describe a device-focused workplace intelligence product, not a public Humane developer API. No official API documentation, authentication, pricing, limits, or CORS policy was found."
}